Post_Date	Content_Type	Episode_ID	Dashboard_Title	Main_Thesis	Punchline_or_Hook	Visual_Situation	Image_Prompt_Short	Grok_Video_10s	Post_RU	Post_EN	CTA	Status	Channel	Notes
2026-06-26	Мифопсия	MYTH-004	МИФОПСИЯ* #04 — Термозащита	Миф: термозащита делает утюжок безопасным.	Термозащита — не бронежилет. Она просто просит температуру не сходить с ума.	Власа расследует перегретую прядь: утюжок лежит как подозреваемый, термозащита выступает как адвокат, рядом карточка «УЛИКА: ПЕРЕГРЕТАЯ ПРЯДЬ». На приборе: «ЗАЩИТА ≠ БЕССМЕРТИЕ».	Luxury beauty-noir lab, Vlasa in white B.Like coat, overheated hair strand as evidence, flat iron as suspect, heat protection bottle as lawyer, Russian typography: МИФОПСИЯ* #04, Термозащита — не бронежилет.	10 sec: slow push-in to evidence tray; heat shimmer above flat iron; Vlasa points tweezers at overheated strand; final look to camera, ironic verdict. Keep Russian text unchanged.	МИФОПСИЯ* #04. Миф: термозащита делает утюжок безопасным. Вердикт Власы: термозащита — не бронежилет. Она снижает риск, но не отменяет перегрев, слишком высокую температуру и ежедневное насилие над полотном.	MYTH AUTOPSY* #04. Myth: heat protectant makes a flat iron safe. Vlasa’s verdict: heat protection is not body armor. It lowers risk, but it does not cancel overheating, high temperature, or daily violence against the hair fiber.	Смотреть разбор	Approved	Tomorrow	Готово для генерации картинки и видео
2026-06-27	Мифопсия	MYTH-005	МИФОПСИЯ* #05 — Кератин	Миф: если добавить больше кератина, волосы станут здоровее.	Кератин — не строительная пена. Больше не всегда значит лучше.	Власа смотрит на флакон кератина как на подозреваемого. На столе прядь, визуально перегруженная продуктом, будто в гипсе. Карточка: «УЛИКА: ПЕРЕГРУЖЕННАЯ ПРЯДЬ». На приборе: «ДОЗИРОВКА РЕШАЕТ».	Premium lab scene, Vlasa, liquid keratin bottle as suspect, overloaded hair strand like evidence, Russian text: МИФОПСИЯ* #05, Кератин — не строительная пена, Дозировка решает.	10 sec: camera glides from keratin bottle to overloaded strand; Vlasa pauses, lowers pipette, shakes head slightly; final warm reflection on plaque ДОЗИРОВКА РЕШАЕТ.	МИФОПСИЯ* #05. Миф: больше кератина — здоровее волосы. Вердикт: кератин даёт ощущение плотности и гладкости, но передозировка может перегрузить полотно. Лаборатория любит не щедрость, а дозировку.	MYTH AUTOPSY* #05. Myth: more keratin means healthier hair. Verdict: keratin can add the feel of density and smoothness, but too much can overload the fiber. The lab does not worship generosity. It respects dosage.	Открыть актив	Approved	Scheduled	Готово для публикации после #04
2026-06-28	Протокол	PROTOCOL-BASE-001	Протокол BASE — мягкая поддержка	Базовый сценарий ухода для мягкости, эластичности и визуального порядка.	Не реанимация. Просто волосы перестают выглядеть как письмо без адресата.	Власа собирает две ампулы/флакона в светлой лаборатории: PRODEW 500 и Liquid Keratin. Мини-схема на стеклянной панели: «Мягкость → Эластичность → Гладкость».	Light luxury lab, Vlasa assembles BASE protocol with PRODEW 500 and Liquid Keratin, warm glass, stone, soft green plants, Russian labels, clean infographic panel.	10 sec: close-up bottles; Vlasa places them into protocol tray; soft glow connects ingredients; final shot on card ПРОТОКОЛ BASE.	Протокол BASE — когда волосам не нужен драматический спасательный вертолёт, а нужна спокойная регулярная поддержка: мягкость, эластичность и более гладкое ощущение полотна.	BASE protocol is not a rescue helicopter. It is calm, regular support: softness, elasticity, and a smoother cosmetic feel of the hair fiber.	Собрать BASE	Idea	Scheduled	Для продуктовой страницы и dashboard
2026-06-29	Аксессуар	TOOL-BOARD-001	Карбоновый планшет B.Like	Тонкая жёсткая опора помогает работать ближе к корню и контролировать прядь.	Планшет не красит волосы. Он просто не мешает мастеру быть точным.	Власа в лаборатории кладёт прядь на карбоновый планшет как на операционный стол. Рядом фольга, кисть, аккуратная диаграмма у корня. Карточка: «УЛИКА: НЕТ ОПОРЫ — НЕТ КОНТРОЛЯ».	Premium lab accessory shot, B.Like carbon color board with hair strand, foil and brush, Vlasa as lab guide, clean Russian typography, product-first composition.	10 sec: slow macro along carbon texture; hair strand placed close to root zone; Vlasa taps the board lightly; final product hero shot.	Карбоновый планшет — это не декор для фото. Это рабочая опора: натяжение, контроль, близость к корню и меньше хаоса в пряди.	A carbon color board is not a photo prop. It is working support: tension, control, closeness to the root, and less chaos in the strand.	Смотреть планшеты	Idea	Scheduled	Можно связать с карточкой товара
2026-06-30	Продукт	ACTIVE-PRODEW-001	PRODEW 500 — аминокислотная логика	Аминокислотный комплекс для мягкости, эластичности и ощущения увлажнения.	PRODEW 500 не волшебник. Он просто слишком воспитанный, чтобы спорить с сухостью громко.	Власа держит коричневый флакон PRODEW 500 с чёрной пипеткой. На стеклянной панели: «мягкость», «эластичность», «комфорт полотна».	Bright luxury lab, amber dropper bottle PRODEW 500, Vlasa, soft green botanical background, Russian explanatory text, premium product card mood.	10 sec: macro pipette drop; soft glow through amber bottle; Vlasa writes PRODEW 500 on lab card; final bottle hero frame.	PRODEW 500 — это аминокислотная история про мягкость и эластичность. Не обещаем чудо. Обещаем более разумную схему ухода, если использовать по дозировке.	PRODEW 500 is an amino-acid story about softness and elasticity. No miracle promise. Just a smarter care logic when dosage is respected.	Открыть PRODEW 500	Idea	Scheduled	Подходит для страницы Products
2026-07-01	Маска	MASK-LINE-001	Маски B.Like — не одна банка на все беды	Маска должна соответствовать состоянию волос, а не настроению полки в ванной.	Одна маска на всё — это как один диагноз на весь подъезд.	Власа расставляет несколько масок по типам волос: сухие, повреждённые, окрашенные. На лабораторной панели схема выбора: «состояние → задача → активы».	Light premium lab, Vlasa arranging B.Like hair masks by hair type, Russian labels, clean protocol chart, elegant not cluttered.	10 sec: jars slide into three labeled zones; Vlasa marks checkboxes; final card: МАСКА ПО СОСТОЯНИЮ ВОЛОС.	Маска работает лучше, когда её выбирают под состояние волос. Сухость, повреждение, окрашенное полотно и кожа головы — это не одна и та же задача.	A mask works better when it is chosen for the actual condition of the hair. Dryness, damage, colored fiber, and scalp concerns are not the same task.	Выбрать маску	Idea	Scheduled	Для отдельного блока масок
2026-07-02	Мифопсия	MYTH-006	МИФОПСИЯ* #06 — Дорогая маска	Миф: чем дороже маска, тем лучше результат.	Цена не диагностирует волосы. Она просто красиво стоит на полке.	Власа проводит допрос двух банок: дорогой и рабочей. На столе прядь, карточка «УЛИКА: НЕПРАВИЛЬНЫЙ ВЫБОР». Вердикт: состояние волос важнее цены.	Beauty-noir lab, Vlasa interrogates two hair mask jars, one luxury one simple, Russian text: Цена не диагностирует волосы, condition-first logic.	10 sec: camera between two jars; Vlasa places hair strand under light; final verdict card: СОСТОЯНИЕ ВАЖНЕЕ ЦЕНЫ.	МИФОПСИЯ* #06. Миф: дорогая маска автоматически лучше. Вердикт: цена не диагностирует волосы. Работает не самая дорогая банка, а самая подходящая задача и схема применения.	MYTH AUTOPSY* #06. Myth: an expensive mask is automatically better. Verdict: price does not diagnose hair. The best jar is the one that matches the task and the routine.	Смотреть подбор	Draft	Scheduled	Идея, можно доработать